[
  {
    "id": "cbi-dma-capital",
    "revisionId": "cbi-dma-capital-ffbc8341e5bb802f",
    "subject": "cbi-dma",
    "predicate": "capital",
    "value": "US$200,000 EDF contribution",
    "verification": "partial",
    "valueStatus": "known",
    "conditions": [],
    "evidence": [
      {
        "sourceId": "dm",
        "locator": "US$200,000 single; US$250,000 up to four; additional fees and dependants.",
        "scope": "Dated review of stated claim; not a complete legal or applicant assessment"
      }
    ],
    "reviewedAt": "2026-10-13",
    "reviewDueAt": "2026-10-27",
    "reviewMethod": "Migrated CBI editorial review; source retrieval limitations retained",
    "observedAt": "2026-10-13",
    "effectiveFrom": null,
    "effectiveUntil": null,
    "limitations": []
  },
  {
    "id": "cbi-dma-capitalType",
    "revisionId": "cbi-dma-capitalType-95f7752d3193948f",
    "subject": "cbi-dma",
    "predicate": "capitalType",
    "value": "Non-refundable contribution",
    "verification": "partial",
    "valueStatus": "known",
    "conditions": [],
    "evidence": [
      {
        "sourceId": "dm",
        "locator": "US$200,000 single; US$250,000 up to four; additional fees and dependants.",
        "scope": "Dated review of stated claim; not a complete legal or applicant assessment"
      },
      {
        "sourceId": "dm-property",
        "locator": "Approved property US$200,000; three-year hold; government fees from US$75,000.",
        "scope": "Dated review of stated claim; not a complete legal or applicant assessment"
      },
      {
        "sourceId": "dm-timing",
        "locator": "Approval timing is not passport delivery; passport requires a separate application",
        "scope": "Dated review of stated claim; not a complete legal or applicant assessment"
      }
    ],
    "reviewedAt": "2026-10-13",
    "reviewDueAt": "2026-10-27",
    "reviewMethod": "Migrated CBI editorial review; source retrieval limitations retained",
    "observedAt": "2026-10-13",
    "effectiveFrom": null,
    "effectiveUntil": null,
    "limitations": []
  },
  {
    "id": "cbi-dma-hold",
    "revisionId": "cbi-dma-hold-8176ca6c2008dfcb",
    "subject": "cbi-dma",
    "predicate": "hold",
    "value": "Approved property USD 200,000; hold 3 years, or 5 years before resale to a subsequent CBI applicant.",
    "verification": "partial",
    "valueStatus": "known",
    "conditions": [],
    "evidence": [
      {
        "sourceId": "dm",
        "locator": "US$200,000 single; US$250,000 up to four; additional fees and dependants.",
        "scope": "Dated review of stated claim; not a complete legal or applicant assessment"
      },
      {
        "sourceId": "dm-property",
        "locator": "Approved property US$200,000; three-year hold; government fees from US$75,000.",
        "scope": "Dated review of stated claim; not a complete legal or applicant assessment"
      },
      {
        "sourceId": "dm-timing",
        "locator": "Approval timing is not passport delivery; passport requires a separate application",
        "scope": "Dated review of stated claim; not a complete legal or applicant assessment"
      }
    ],
    "reviewedAt": "2026-10-13",
    "reviewDueAt": "2026-10-27",
    "reviewMethod": "Migrated CBI editorial review; source retrieval limitations retained",
    "observedAt": "2026-10-13",
    "effectiveFrom": null,
    "effectiveUntil": null,
    "limitations": []
  },
  {
    "id": "cbi-dma-presence",
    "revisionId": "cbi-dma-presence-e4def1ce00ccfc28",
    "subject": "cbi-dma",
    "predicate": "presence",
    "value": "Direct naturalisation; current presence obligations must be checked for the applicant cohort",
    "verification": "partial",
    "valueStatus": "known",
    "conditions": [],
    "evidence": [
      {
        "sourceId": "dm",
        "locator": "US$200,000 single; US$250,000 up to four; additional fees and dependants.",
        "scope": "Dated review of stated claim; not a complete legal or applicant assessment"
      },
      {
        "sourceId": "dm-property",
        "locator": "Approved property US$200,000; three-year hold; government fees from US$75,000.",
        "scope": "Dated review of stated claim; not a complete legal or applicant assessment"
      },
      {
        "sourceId": "dm-timing",
        "locator": "Approval timing is not passport delivery; passport requires a separate application",
        "scope": "Dated review of stated claim; not a complete legal or applicant assessment"
      }
    ],
    "reviewedAt": "2026-10-13",
    "reviewDueAt": "2026-10-27",
    "reviewMethod": "Migrated CBI editorial review; source retrieval limitations retained",
    "observedAt": "2026-10-13",
    "effectiveFrom": null,
    "effectiveUntil": null,
    "limitations": []
  },
  {
    "id": "cbi-dma-family",
    "revisionId": "cbi-dma-family-188b6184e77532d6",
    "subject": "cbi-dma",
    "predicate": "family",
    "value": "US$250,000 main applicant + up to 3 qualifying dependants",
    "verification": "partial",
    "valueStatus": "known",
    "conditions": [],
    "evidence": [
      {
        "sourceId": "dm",
        "locator": "US$200,000 single; US$250,000 up to four; additional fees and dependants.",
        "scope": "Dated review of stated claim; not a complete legal or applicant assessment"
      },
      {
        "sourceId": "dm-property",
        "locator": "Approved property US$200,000; three-year hold; government fees from US$75,000.",
        "scope": "Dated review of stated claim; not a complete legal or applicant assessment"
      },
      {
        "sourceId": "dm-timing",
        "locator": "Approval timing is not passport delivery; passport requires a separate application",
        "scope": "Dated review of stated claim; not a complete legal or applicant assessment"
      }
    ],
    "reviewedAt": "2026-10-13",
    "reviewDueAt": "2026-10-27",
    "reviewMethod": "Migrated CBI editorial review; source retrieval limitations retained",
    "observedAt": "2026-10-13",
    "effectiveFrom": null,
    "effectiveUntil": null,
    "limitations": []
  },
  {
    "id": "cbi-dma-caveat",
    "revisionId": "cbi-dma-caveat-0dd8293e6064c7cb",
    "subject": "cbi-dma",
    "predicate": "caveat",
    "value": "Property attracts government fees from US$75,000. Screening, interview, documents and agent costs are extra.",
    "verification": "partial",
    "valueStatus": "known",
    "conditions": [],
    "evidence": [
      {
        "sourceId": "dm",
        "locator": "US$200,000 single; US$250,000 up to four; additional fees and dependants.",
        "scope": "Dated review of stated claim; not a complete legal or applicant assessment"
      },
      {
        "sourceId": "dm-property",
        "locator": "Approved property US$200,000; three-year hold; government fees from US$75,000.",
        "scope": "Dated review of stated claim; not a complete legal or applicant assessment"
      },
      {
        "sourceId": "dm-timing",
        "locator": "Approval timing is not passport delivery; passport requires a separate application",
        "scope": "Dated review of stated claim; not a complete legal or applicant assessment"
      }
    ],
    "reviewedAt": "2026-10-13",
    "reviewDueAt": "2026-10-27",
    "reviewMethod": "Migrated CBI editorial review; source retrieval limitations retained",
    "observedAt": "2026-10-13",
    "effectiveFrom": null,
    "effectiveUntil": null,
    "limitations": []
  },
  {
    "id": "cbi-dma-alert",
    "revisionId": "cbi-dma-alert-708f8de80e979aa7",
    "subject": "cbi-dma",
    "predicate": "alert",
    "value": "",
    "verification": "partial",
    "valueStatus": "known",
    "conditions": [],
    "evidence": [
      {
        "sourceId": "dm",
        "locator": "US$200,000 single; US$250,000 up to four; additional fees and dependants.",
        "scope": "Dated review of stated claim; not a complete legal or applicant assessment"
      },
      {
        "sourceId": "dm-property",
        "locator": "Approved property US$200,000; three-year hold; government fees from US$75,000.",
        "scope": "Dated review of stated claim; not a complete legal or applicant assessment"
      },
      {
        "sourceId": "dm-timing",
        "locator": "Approval timing is not passport delivery; passport requires a separate application",
        "scope": "Dated review of stated claim; not a complete legal or applicant assessment"
      }
    ],
    "reviewedAt": "2026-10-13",
    "reviewDueAt": "2026-10-27",
    "reviewMethod": "Migrated CBI editorial review; source retrieval limitations retained",
    "observedAt": "2026-10-13",
    "effectiveFrom": null,
    "effectiveUntil": null,
    "limitations": []
  },
  {
    "id": "cbi-dma-processing",
    "revisionId": "cbi-dma-processing-b8a3615002db9b64",
    "subject": "cbi-dma",
    "predicate": "processing",
    "value": "3–6 months to approval (most complete files)",
    "verification": "partial",
    "valueStatus": "known",
    "conditions": [],
    "evidence": [
      {
        "sourceId": "dm",
        "locator": "US$200,000 single; US$250,000 up to four; additional fees and dependants.",
        "scope": "Dated review of stated claim; not a complete legal or applicant assessment"
      },
      {
        "sourceId": "dm-property",
        "locator": "Approved property US$200,000; three-year hold; government fees from US$75,000.",
        "scope": "Dated review of stated claim; not a complete legal or applicant assessment"
      },
      {
        "sourceId": "dm-timing",
        "locator": "Approval timing is not passport delivery; passport requires a separate application",
        "scope": "Dated review of stated claim; not a complete legal or applicant assessment"
      }
    ],
    "reviewedAt": "2026-10-13",
    "reviewDueAt": "2026-10-27",
    "reviewMethod": "Migrated CBI editorial review; source retrieval limitations retained",
    "observedAt": "2026-10-13",